{
  "contract": "ll.context/1",
  "context_id": "ctx-fixture",
  "request_id": "req-fixture",
  "scope": {
    "course_id": "fixture-course",
    "term": "fixture-term"
  },
  "instructions": [
    {
      "path": "instructions/policy.md",
      "sha256": "aaaaaaaaaaaaaaaaaaaaaaaaaaaaaaaaaaaaaaaaaaaaaaaaaaaaaaaaaaaaaaaa",
      "bytes": 12,
      "media_type": "application/json"
    }
  ],
  "sources": [
    {
      "source_id": "fixture-source",
      "version_id": "fixture-v1",
      "sha256": "bbbbbbbbbbbbbbbbbbbbbbbbbbbbbbbbbbbbbbbbbbbbbbbbbbbbbbbbbbbbbbbb",
      "locator": {
        "kind": "page",
        "page": 1,
        "printed_label": null
      }
    }
  ],
  "effective_attempts": [],
  "known_solution_exposure": "unknown",
  "native_history_blind": false,
  "created_at": "2026-10-03T12:00:00Z",
  "policy_revision": "cccccccccccccccccccccccccccccccccccccccccccccccccccccccccccccccc",
  "selection_note": "Fixture context only; no native conversation was read."
}
